{
  "schema_version": 1,
  "id": "russian",
  "display_name": "Русский язык / норма и употребление",
  "source_namespace": "RU",
  "source_type": "project_core",
  "source_branch": "main",
  "reviewer_id": "russian",
  "adapter": "review_v1",
  "linter_path": "scripts/lint_russian.py",
  "enabled_by_default": true,
  "status": "OPERATIONAL",
  "references": [
    "references/russian-language.md",
    "docs/russian-error-priorities.md",
    "libraries/russian/rules.json"
  ],
  "notes": "Нормативные правила становятся guardrails; употребление, РКИ-похожие интерференции и регистр остаются неблокирующими review findings, если не подтверждены как NORM."
}
