{
  "schema_version": 1,
  "id": "sample-author",
  "display_name": "Имя автора",
  "source_namespace": "SAMPLE",
  "source_type": "book",
  "source_branch": "sample-author",
  "reviewer_id": "sample-author",
  "adapter": "review_v1",
  "linter_path": "scripts/lint_sample_author.py",
  "enabled_by_default": false,
  "status": "AUDITED",
  "references": [
    "references/sample-author.md"
  ],
  "notes": "Скопируйте этот каталог, замените заполнители, добавьте проверки и включайте библиотеку только после аудита интеграции."
}
